title,description,timestamp
A Fact Check of Trump’s Claims on Inflation and Gas Prices in Iran War,"He has minimized soaring gas prices, rising inflation and the American economy’s need for the Strait of Hormuz.","time.struct_time(tm_year=2026, tm_mon=5, tm_mday=14, tm_hour=13, tm_min=0, tm_sec=5, tm_wday=3, tm_yday=134, tm_isdst=0)"
U.C.L.A. Considers New Tactics to Combat Antisemitism,"The Trump administration has sued the university, saying it didn’t do enough to protect Jews on campus.","time.struct_time(tm_year=2026, tm_mon=5, tm_mday=14, tm_hour=12, tm_min=30, tm_sec=5, tm_wday=3, tm_yday=134, tm_isdst=0)"
Prospect of Alex Murdaugh Retrial Puts Rural South Carolina Back in Spotlight,The State Supreme Court cited a local court clerk in reversing the result of one of the most-watched murder trials of the last decade. It has raised painful memories in the state’s Lowcountry region.,"time.struct_time(tm_year=2026, tm_mon=5, tm_mday=14, tm_hour=9, tm_min=6, tm_sec=29, tm_wday=3, tm_yday=134, tm_isdst=0)"
Why the Migrant Child Crisis Is Roiling the California Governor Race,"The Times broke the story that has become a dominant line of attack against Xavier Becerra, the Democratic front-runner. Here are five things to know about it.","time.struct_time(tm_year=2026, tm_mon=5, tm_mday=14, tm_hour=9, tm_min=5, tm_sec=20, tm_wday=3, tm_yday=134, tm_isdst=0)"
Will Her Daughter Be Safe at Pali High as It Rebuilds From LA Wildfires?,"It’s a nightmare faced by families all around Los Angeles: After wildfire smoke blanketed homes, schools and offices with toxic chemicals, when is it OK to go back?","time.struct_time(tm_year=2026, tm_mon=5, tm_mday=14, tm_hour=9, tm_min=2, tm_sec=33, tm_wday=3, tm_yday=134, tm_isdst=0)"
Bo French Challenges Texas Oil Regulator in GOP Runoff,"Bo French, a hard-liner known for wild social media posts, is seeking a bigger megaphone. Big oil companies, and top officials like Greg Abbott, want to stop him.","time.struct_time(tm_year=2026, tm_mon=5, tm_mday=14, tm_hour=9, tm_min=1, tm_sec=24, tm_wday=3, tm_yday=134, tm_isdst=0)"
What It’s Like to Own a Tank or Other Former Military Vehicles,"Where do battle tanks and military trucks go when their service has ended? Enthusiasts and professionals put them to work for search and rescue, marketing and just having fun.","time.struct_time(tm_year=2026, tm_mon=5, tm_mday=14, tm_hour=9, tm_min=0, tm_sec=17, tm_wday=3, tm_yday=134, tm_isdst=0)"
Midsize Cities Held Steady as U.S. Population Growth Declined,New census estimates show that the nation’s largest cities saw the sharpest slowdowns in population growth over the past year amid declines in immigration and plunging birthrates.,"time.struct_time(tm_year=2026, tm_mon=5, tm_mday=14, tm_hour=4, tm_min=1, tm_sec=5, tm_wday=3, tm_yday=134, tm_isdst=0)"
South Carolina Governor Plans Special Session to Redraw House Maps,"Gov. Henry McMaster, a Republican, appears prepared to thrust the state into the nation’s redistricting wars.","time.struct_time(tm_year=2026, tm_mon=5, tm_mday=14, tm_hour=3, tm_min=30, tm_sec=7, tm_wday=3, tm_yday=134, tm_isdst=0)"
U.S. Cruise Passenger Moved Out of Isolation,"The passenger, who had tested positive once in the Canary Islands, was being monitored in a special biocontainment facility in Omaha, until a new test came back negative.","time.struct_time(tm_year=2026, tm_mon=5, tm_mday=14, tm_hour=2, tm_min=20, tm_sec=51, tm_wday=3, tm_yday=134, tm_isdst=0)"
11 Rescued From Raft After Plane Crash Off the Coast of Florida,"Those on board, who were all Bahamian adults, spent about five hours stranded on a raft before rescuers hoisted them to safety. All were in stable condition, officials said.","time.struct_time(tm_year=2026, tm_mon=5, tm_mday=14, tm_hour=1, tm_min=1, tm_sec=19, tm_wday=3, tm_yday=134, tm_isdst=0)"
Justice Dept. Sues D.C. Bar Over Efforts to Discipline Government Lawyers,The move escalates the administration’s feud with legal disciplinary bodies over the ethical conduct of government lawyers.,"time.struct_time(tm_year=2026, tm_mon=5, tm_mday=14, tm_hour=0, tm_min=58, tm_sec=52, tm_wday=3, tm_yday=134, tm_isdst=0)"
Denise Powell Wins Democratic Primary in Key Nebraska House Race,"Denise Powell prevailed in a close primary race for an Omaha-based seat, currently held by a retiring Republican, that could help determine control of the House.","time.struct_time(tm_year=2026, tm_mon=5, tm_mday=14, tm_hour=1, tm_min=20, tm_sec=42, tm_wday=3, tm_yday=134, tm_isdst=0)"
House Approves Year-Round Sale of Higher-Ethanol Gas,"In a rare bipartisan vote, the House passed a bill allowing for the sale of an ethanol blend known as E15, over the objections of Republican hard-liners and some oil refiners.","time.struct_time(tm_year=2026, tm_mon=5, tm_mday=13, tm_hour=23, tm_min=49, tm_sec=13, tm_wday=2, tm_yday=133, tm_isdst=0)"
Second Venezuelan Doctor Is Released From Immigration Custody,"At least five foreign-born doctors have been detained, according to a medical organization, raising fears that underserved rural areas reliant on them could be further strained.","time.struct_time(tm_year=2026, tm_mon=5, tm_mday=13, tm_hour=23, tm_min=39, tm_sec=35, tm_wday=2, tm_yday=133, tm_isdst=0)"
New Mexico Diocese Tries to Block Government From Seizing Land for Border Wall,"The diocese’s lawyers argued that the land, which is below a 29-foot-tall statue of Jesus Christ on a mountain peak, is a holy site protected under religious freedom.","time.struct_time(tm_year=2026, tm_mon=5, tm_mday=13, tm_hour=23, tm_min=10, tm_sec=52, tm_wday=2, tm_yday=133, tm_isdst=0)"
Duffy’s ‘Great American Road Trip’ Prompts Ethical Concerns,"A YouTube series starring Transportation Secretary Sean Duffy and his family is part of the nation’s 250th anniversary celebrations, but it doubled as a family excursion for them.","time.struct_time(tm_year=2026, tm_mon=5, tm_mday=14, tm_hour=1, tm_min=32, tm_sec=54, tm_wday=3, tm_yday=134, tm_isdst=0)"
How Jerome Powell Managed a Chaotic Era,"Our reporter Colby Smith, who covers the Federal Reserve and the economy, looks back at Jerome Powell’s tenure as chair of the Fed.","time.struct_time(tm_year=2026, tm_mon=5, tm_mday=13, tm_hour=22, tm_min=46, tm_sec=11, tm_wday=2, tm_yday=133, tm_isdst=0)"
Trump Administration Will Withhold $1.3 Billion in Medicaid Payments to California,Vice President JD Vance said the state had not done enough to fight fraud in the public health insurance program.,"time.struct_time(tm_year=2026, tm_mon=5, tm_mday=13, tm_hour=22, tm_min=35, tm_sec=3, tm_wday=2, tm_yday=133, tm_isdst=0)"
Miami Residents Sue Over Trump’s Plan to Make His Library a Hotel,"The suit argues that the development on state-donated land would violate the Constitution’s domestic emoluments clause, which prohibits the president from accepting money or gifts from states.","time.struct_time(tm_year=2026, tm_mon=5, tm_mday=13, tm_hour=21, tm_min=58, tm_sec=12, tm_wday=2, tm_yday=133, tm_isdst=0)"
Homeland Security Dept. Escalates Its Dispute With Federal Judge,"In a column, the top lawyer for D.H.S. claimed that the judge, Melissa DuBose, was engaging in an “intimidation campaign” by referring a government lawyer for a misconduct investigation.","time.struct_time(tm_year=2026, tm_mon=5, tm_mday=13, tm_hour=21, tm_min=21, tm_sec=46, tm_wday=2, tm_yday=133, tm_isdst=0)"
Trump’s Remark on Americans’ Finances and Iran War Points to GOP Midterm Challenges,"Asked if he was motivated by Americans’ financial woes to make a deal to end the war with Iran, he responded, “Not even a little bit.”","time.struct_time(tm_year=2026, tm_mon=5, tm_mday=14, tm_hour=0, tm_min=42, tm_sec=45, tm_wday=3, tm_yday=134, tm_isdst=0)"
Kouri Richins Sentenced to Life in Prison for Poisoning Her Husband,"Kouri Richins, 36, who wrote a children’s book about grief after murdering Eric Richins, will serve without the option of parole.","time.struct_time(tm_year=2026, tm_mon=5, tm_mday=13, tm_hour=21, tm_min=15, tm_sec=22, tm_wday=2, tm_yday=133, tm_isdst=0)"
Georgia Governor Brian Kemp Calls Special Session to Redistrict for 2028 Elections,"Gov. Brian Kemp, a Republican, also asked lawmakers to delay changes to the state’s election system that could cause disarray in the midterms.","time.struct_time(tm_year=2026, tm_mon=5, tm_mday=13, tm_hour=20, tm_min=47, tm_sec=25, tm_wday=2, tm_yday=133, tm_isdst=0)"
The Family Branding of Sean Duffy’s Road Trip Reality Show,A trailer heralds the latest spinoff from the Trump administration.,"time.struct_time(tm_year=2026, tm_mon=5, tm_mday=14, tm_hour=13, tm_min=0, tm_sec=43, tm_wday=3, tm_yday=134, tm_isdst=0)"
How an Image of Washington at Prayer Became a Touchstone for the Right,"A scene inspired by the winter at Valley Forge has become more prominent in the Trump era, along with claims that the United States was founded as a Christian nation.","time.struct_time(tm_year=2026, tm_mon=5, tm_mday=14, tm_hour=9, tm_min=3, tm_sec=29, tm_wday=3, tm_yday=134, tm_isdst=0)"
Conservative Influencers Tap a Nonprofit to Pay for Their Security,"A charity is raising money to provide security, arguing that protecting some of right-wing media’s biggest stars is a public good.","time.struct_time(tm_year=2026, tm_mon=5, tm_mday=14, tm_hour=9, tm_min=1, tm_sec=59, tm_wday=3, tm_yday=134, tm_isdst=0)"
Crypto Industry Pushes a Bill to Tilt Regulation in Its Favor,"After a series of political victories under President Trump, firms are lobbying Congress for a sweeping framework they helped shape.","time.struct_time(tm_year=2026, tm_mon=5, tm_mday=14, tm_hour=9, tm_min=0, tm_sec=7, tm_wday=3, tm_yday=134, tm_isdst=0)"
"Dan Loeb, Bobby Kotick and Other Business Leaders Backing Spencer Pratt","The former reality-TV star has shaken up the Los Angeles mayoral race, gaining support from deep-pocketed donors like the financier Daniel S. Loeb.","time.struct_time(tm_year=2026, tm_mon=5, tm_mday=14, tm_hour=12, tm_min=20, tm_sec=19, tm_wday=3, tm_yday=134, tm_isdst=0)"
Mamdani Urges State to Block Western Union’s Deal for Intermex,New York City’s mayor said the company’s proposed acquisition of Intermex could make it costlier for immigrants to send money abroad.,"time.struct_time(tm_year=2026, tm_mon=5, tm_mday=14, tm_hour=1, tm_min=44, tm_sec=0, tm_wday=3, tm_yday=134, tm_isdst=0)"
Fatih Birol of the International Energy Agency: What It Will Take to End the Energy Crisis,"Fatih Birol of the International Energy Agency, who orchestrated a multinational release of oil reserves, detailed the risks facing the economy now and beyond.","time.struct_time(tm_year=2026, tm_mon=5, tm_mday=13, tm_hour=16, tm_min=55, tm_sec=58, tm_wday=2, tm_yday=133, tm_isdst=0)"
Why ‘Smart’ Products Have Started to Look Like the Dumb Choice,"How Wi-Fi-connecting, app-based tech led to a backlash in the name of simplicity","time.struct_time(tm_year=2026, tm_mon=5, tm_mday=14, tm_hour=9, tm_min=4, tm_sec=10, tm_wday=3, tm_yday=134, tm_isdst=0)"
Ishmael Reed Is Writing a Play About Elon Musk,"Ishmael Reed, provocateur and playwright, has a few words for the billionaires of Silicon Valley.","time.struct_time(tm_year=2026, tm_mon=5, tm_mday=14, tm_hour=9, tm_min=2, tm_sec=52, tm_wday=3, tm_yday=134, tm_isdst=0)"
Xi’s Taiwan Warning to Trump Highlights Tensions in Beijing Summit,The Chinese leader’s comment that any mishandling of Taiwan could lead to “an extremely dangerous situation” raised an issue that has loomed over President Trump’s trip.,"time.struct_time(tm_year=2026, tm_mon=5, tm_mday=14, tm_hour=12, tm_min=33, tm_sec=0, tm_wday=3, tm_yday=134, tm_isdst=0)"
Dispute Over Secret Visit Shows Limits of U.A.E.-Israel Embrace,The Gulf nation’s denial of a trip by Israel’s Netanyahu reflects the complications of dealing with a leader seen in the region as a destabilizing force.,"time.struct_time(tm_year=2026, tm_mon=5, tm_mday=14, tm_hour=12, tm_min=16, tm_sec=0, tm_wday=3, tm_yday=134, tm_isdst=0)"
Military Snipers Are Being Put Out of a Job by Drones,A special forces soldier that Ukraine claimed was a world-record shot hasn’t been out to shoot in more than a year.,"time.struct_time(tm_year=2026, tm_mon=5, tm_mday=14, tm_hour=3, tm_min=0, tm_sec=0, tm_wday=3, tm_yday=134, tm_isdst=0)"
The Reign of ‘El Chapo’ Is Over but the Bodies Keep Piling Up,"As the U.S. targets corrupt Mexican officials who aided the imprisoned drug lord’s clan, a civil war rages for control of the Sinaloa cartel.","time.struct_time(tm_year=2026, tm_mon=5, tm_mday=14, tm_hour=1, tm_min=0, tm_sec=0, tm_wday=3, tm_yday=134, tm_isdst=0)"
Canadian Judge Deals Blow to Alberta’s Sovereignty Movement on Referendum,A judge said the Alberta government failed to consult indigenous groups about the potential fallout from holding a vote on the province’s future within Canada.,"time.struct_time(tm_year=2026, tm_mon=5, tm_mday=13, tm_hour=23, tm_min=38, tm_sec=0, tm_wday=2, tm_yday=133, tm_isdst=0)"
Venezuela Launches Effort to Ease Its $170 Billion Debt Load,"The country has been shut out of global markets since 2017, and it will seek a reorganization as relations with the U.S. thaw.","time.struct_time(tm_year=2026, tm_mon=5, tm_mday=13, tm_hour=23, tm_min=8, tm_sec=0, tm_wday=2, tm_yday=133, tm_isdst=0)"
"Sterling Could Fall if U.S. Data Lift Dollar, U.K. Political Fears Rise","Sterling could fall further against the dollar if upcoming U.S. data are strong and U.K. political concerns intensify, SocGen said, adding that political headlines could easily trigger a move toward $1.32.","time.struct_time(tm_year=2026, tm_mon=5, tm_mday=14, tm_hour=11, tm_min=19, tm_sec=0, tm_wday=3, tm_yday=134, tm_isdst=0)"
Opinion | The Truth About Hamas,"Documenting its rape, torture and mutilation on Oct. 7 and after, even as many choose to deny what happened.","time.struct_time(tm_year=2026, tm_mon=5, tm_mday=13, tm_hour=21, tm_min=42, tm_sec=0, tm_wday=2, tm_yday=133, tm_isdst=0)"
Opinion | Taiwan’s Advance on Self-Defense,The island boosts its spending after a raucous democratic debate.,"time.struct_time(tm_year=2026, tm_mon=5, tm_mday=13, tm_hour=21, tm_min=36, tm_sec=0, tm_wday=2, tm_yday=133, tm_isdst=0)"
Opinion | Taiwan Is the Key to AI Dominance,The island is much more than a bargaining chip. It’s the center of the world’s most important tech stack.,"time.struct_time(tm_year=2026, tm_mon=5, tm_mday=13, tm_hour=21, tm_min=1, tm_sec=0, tm_wday=2, tm_yday=133, tm_isdst=0)"
Ireland’s Foreign Investment Chief Sees Inflows Holding Up Despite Headwinds,"As one of the main beneficiaries of globalization, Ireland continues to pin its hopes on attracting foreign businesses.","time.struct_time(tm_year=2026, tm_mon=5, tm_mday=14, tm_hour=12, tm_min=4, tm_sec=0, tm_wday=3, tm_yday=134, tm_isdst=0)"
Pentagon Abruptly Cancels Deployment to Europe as Part of Trump’s Drawdown,Equipment and some troops from the armored “Black Jack” brigade were already en route when its deployment was halted.,"time.struct_time(tm_year=2026, tm_mon=5, tm_mday=14, tm_hour=1, tm_min=44, tm_sec=0, tm_wday=3, tm_yday=134, tm_isdst=0)"
Pomp Before Circumstance in China Trip,Trump and Xi will tackle issues such as Iran and trade. The White House has acknowledged that Trump’s visit would be heavier on symbolism and lighter on policy outcomes.,"time.struct_time(tm_year=2026, tm_mon=5, tm_mday=14, tm_hour=3, tm_min=11, tm_sec=0, tm_wday=3, tm_yday=134, tm_isdst=0)"
China’s Best and Brightest Tech Talent Is Going Back to China,"More Chinese nationals who return home after working in the U.S., called ‘sea turtles,’ are fueling Beijing’s efforts to take on Silicon Valley","time.struct_time(tm_year=2026, tm_mon=5, tm_mday=14, tm_hour=2, tm_min=1, tm_sec=0, tm_wday=3, tm_yday=134, tm_isdst=0)"
New York Man Convicted After Opening Chinese Police Station,"The police outpost was used to renew driver’s licenses and hunt a Chinese political opponent, prosecutors alleged.","time.struct_time(tm_year=2026, tm_mon=5, tm_mday=13, tm_hour=22, tm_min=53, tm_sec=0, tm_wday=2, tm_yday=133, tm_isdst=0)"
Uganda’s Central Bank Holds Key Lending Rate at 9.75%,"The central bank maintained its key lending rate, citing subdued inflation, as it continues to monitor the likely economic impact of the Iran war.","time.struct_time(tm_year=2026, tm_mon=5, tm_mday=14, tm_hour=12, tm_min=4, tm_sec=0, tm_wday=3, tm_yday=134, tm_isdst=0)"
The Strait of Hormuz,"The Strait of Hormuz carries about 20% of the world’s crude oil, making it a vital trade artery but a vulnerable one.","time.struct_time(tm_year=2026, tm_mon=5, tm_mday=13, tm_hour=21, tm_min=46, tm_sec=0, tm_wday=2, tm_yday=133, tm_isdst=0)"
Versant Shares Surge Premarket as Company Beats Wall Street Expectations,The gain came despite declines in the company’s revenue and net income on lower subscriber numbers and ad sales.,"time.struct_time(tm_year=2026, tm_mon=5, tm_mday=14, tm_hour=12, tm_min=1, tm_sec=0, tm_wday=3, tm_yday=134, tm_isdst=0)"
Honda Just Had Its Worst Year Ever,The Japanese carmaker reported its first annual loss after it gave up on EVs in the U.S. and its China business collapsed.,"time.struct_time(tm_year=2026, tm_mon=5, tm_mday=14, tm_hour=8, tm_min=45, tm_sec=0, tm_wday=3, tm_yday=134, tm_isdst=0)"
Tate & Lyle In Talks With Ingredion Over $3.7 Billion Takeover Offer,The offer is at a 64% premium to the London-listed food-and-beverage ingredient company’s closing share price Wednesday.,"time.struct_time(tm_year=2026, tm_mon=5, tm_mday=14, tm_hour=12, tm_min=49, tm_sec=0, tm_wday=3, tm_yday=134, tm_isdst=0)"
Chevron to Sell Some Asia-Pacific Assets to Japan’s Eneos for $2.17 Billion,"Chevron has agreed to sell several Asia-Pacific refining and retail assets to Japan’s Eneos for $2.17 billion, as it continues to streamline its international portfolio.","time.struct_time(tm_year=2026, tm_mon=5, tm_mday=14, tm_hour=7, tm_min=40, tm_sec=0, tm_wday=3, tm_yday=134, tm_isdst=0)"
Klarna Swings to Profit as Revenue Jumps,"Klarna swung to a profit in the first quarter as revenue jumped, boosted by continued market share gains and network expansions.","time.struct_time(tm_year=2026, tm_mon=5, tm_mday=14, tm_hour=12, tm_min=10, tm_sec=0, tm_wday=3, tm_yday=134, tm_isdst=0)"
Watches of Switzerland’s Shares Climb After Strong Demand in U.S.,"The luxury-watch retailer forecasts organic revenue growth between 5% and 10% for fiscal 2027 on a constant-currency basis, propelled by strong demand in the key U.S. market.","time.struct_time(tm_year=2026, tm_mon=5, tm_mday=14, tm_hour=10, tm_min=59, tm_sec=0, tm_wday=3, tm_yday=134, tm_isdst=0)"
3i Group Shares Plunge After Slowdown at Retailer Action,"The private-equity company reported weaker profitability at Action, which accounts for the bulk of the group’s portfolio value.","time.struct_time(tm_year=2026, tm_mon=5, tm_mday=14, tm_hour=8, tm_min=47, tm_sec=0, tm_wday=3, tm_yday=134, tm_isdst=0)"
Burberry Posts Higher Sales as Turnaround Efforts Take Effect,Sales climbed 5% as the company continues to undergo a turnaround plan amid difficult market conditions due to geopolitical instability.,"time.struct_time(tm_year=2026, tm_mon=5, tm_mday=14, tm_hour=8, tm_min=33, tm_sec=0, tm_wday=3, tm_yday=134, tm_isdst=0)"
StubHub Swings to First-Quarter Profit as Sales Climb on Ticket Demand,"Chief Executive Eric Baker said trends in the live events and secondary ticketing markets remain healthy, with strong consumer demand and a robust event calendar this year.","time.struct_time(tm_year=2026, tm_mon=5, tm_mday=13, tm_hour=23, tm_min=41, tm_sec=0, tm_wday=2, tm_yday=133, tm_isdst=0)"
"Singapore Airlines Profit Drops, Faces Fuel-Cost Headwinds From Mideast Conflict","Annual revenue climbed to a new high, but profit fell after three straight years of record earnings, adding uncertainty to an outlook already clouded by the Middle East conflict.","time.struct_time(tm_year=2026, tm_mon=5, tm_mday=14, tm_hour=12, tm_min=22, tm_sec=0, tm_wday=3, tm_yday=134, tm_isdst=0)"
Chinese Chip Maker SMIC’s Profit Misses Market Expectations,"SMIC, China’s biggest chip foundry, reported weaker-than-expected net profit at the start of the year as it keeps scaling capacity amid China’s push for chip localization.","time.struct_time(tm_year=2026, tm_mon=5, tm_mday=14, tm_hour=11, tm_min=31, tm_sec=0, tm_wday=3, tm_yday=134, tm_isdst=0)"
"Telefonica Shares Rise After Revenue, Adjusted Earnings Beat Expectations",The telecommunications group posted a narrower net loss as revenue rose in Spain and Brazil in the first quarter.,"time.struct_time(tm_year=2026, tm_mon=5, tm_mday=14, tm_hour=8, tm_min=27, tm_sec=0, tm_wday=3, tm_yday=134, tm_isdst=0)"
Aviva Posts Rise in Insurance Premiums,"The insurer and asset manager’s quarterly general insurance premiums reached £3.4 billion, up 19% compared with a year prior.","time.struct_time(tm_year=2026, tm_mon=5, tm_mday=14, tm_hour=6, tm_min=40, tm_sec=0, tm_wday=3, tm_yday=134, tm_isdst=0)"
Cisco to Shed Jobs for All-In AI Push,"The networking company said Wednesday that it is launching a restructuring that will cost up to $1 billion in severance, one-time termination benefits and other costs.","time.struct_time(tm_year=2026, tm_mon=5, tm_mday=13, tm_hour=22, tm_min=0, tm_sec=0, tm_wday=2, tm_yday=133, tm_isdst=0)"
Opinion | Antisemites Right and Left,To speak plainly about Jew-hatred in one’s own party is hard. It’s also a duty.,"time.struct_time(tm_year=2026, tm_mon=5, tm_mday=13, tm_hour=20, tm_min=58, tm_sec=0, tm_wday=2, tm_yday=133, tm_isdst=0)"
McDonald’s Is Recommitting to Chicago In a Stadium-Naming Deal,The new Chicago Fire soccer stadium will be called McDonald’s Park and is expected to open in 2028.,"time.struct_time(tm_year=2026, tm_mon=5, tm_mday=13, tm_hour=9, tm_min=0, tm_sec=0, tm_wday=2, tm_yday=133, tm_isdst=0)"
Cell Carriers Team Up to Boost Coverage Across the U.S.,"AT&amp;T, T-Mobile US and Verizon Communications are teaming up to boost coverage and connectivity in remote regions across the country.","time.struct_time(tm_year=2026, tm_mon=5, tm_mday=14, tm_hour=11, tm_min=57, tm_sec=0, tm_wday=3, tm_yday=134, tm_isdst=0)"
Stock Market Today: Stock Futures Tick Up With AI Trade Top of Mind Again,Chipmaker Cerebras Systems to start trading after largest IPO of year,"time.struct_time(tm_year=2026, tm_mon=5, tm_mday=14, tm_hour=8, tm_min=1, tm_sec=50, tm_wday=3, tm_yday=134, tm_isdst=0)"
Cerebras to Kick Off Hotly Anticipated Year for Artificial-Intelligence IPOs,The chip company raised its price target this week after strong demand from investors.,"time.struct_time(tm_year=2026, tm_mon=5, tm_mday=14, tm_hour=12, tm_min=58, tm_sec=0, tm_wday=3, tm_yday=134, tm_isdst=0)"
It’s a More Secret Version of Bitcoin and It’s on a Tear,"With many crypto fans souring on bitcoin, some are getting behind Zcash, a privacy token that lets users shield transaction details and remain anonymous.","time.struct_time(tm_year=2026, tm_mon=5, tm_mday=14, tm_hour=12, tm_min=13, tm_sec=0, tm_wday=3, tm_yday=134, tm_isdst=0)"
U.S. Stock Futures Tick Up With AI Trade Top of Mind Again,Futures were on the upswing with stocks tied to artificial intelligence remaining the primary focus of investors.,"time.struct_time(tm_year=2026, tm_mon=5, tm_mday=14, tm_hour=10, tm_min=50, tm_sec=0, tm_wday=3, tm_yday=134, tm_isdst=0)"
The Stock Market’s Fear Gauge Is Faulty,"Plus, Trump in China pumps up tech stocks.","time.struct_time(tm_year=2026, tm_mon=5, tm_mday=14, tm_hour=10, tm_min=33, tm_sec=0, tm_wday=3, tm_yday=134, tm_isdst=0)"
The Cancer Test That Wall Street Is Betting On,One company has a big early lead in blood tests that detect cancer returning in survivors.,"time.struct_time(tm_year=2026, tm_mon=5, tm_mday=14, tm_hour=9, tm_min=30, tm_sec=0, tm_wday=3, tm_yday=134, tm_isdst=0)"
Hedge Funds Are Making a Killing in the ‘Golden Age’ of AI Hardware,Shares of makers of chips and related equipment delivered stock-picking funds such as Steve Cohen’s Point72 their best month in decades.,"time.struct_time(tm_year=2026, tm_mon=5, tm_mday=14, tm_hour=1, tm_min=0, tm_sec=0, tm_wday=3, tm_yday=134, tm_isdst=0)"
Treasury Yields Cool Down as Trump Meets Xi,Treasury yields fell as Trump met with China’s Xi amid U.S. inflation jitters. The Middle East standoff continues and oil prices remain above $100.,"time.struct_time(tm_year=2026, tm_mon=5, tm_mday=14, tm_hour=12, tm_min=52, tm_sec=0, tm_wday=3, tm_yday=134, tm_isdst=0)"
Treasury Yields Pare Down Increase Triggered by Hot Inflation,Yields were little changed after retracing early increases triggered by fears inflation could run high for months —and even drive the Fed to hike rates down the road.,"time.struct_time(tm_year=2026, tm_mon=5, tm_mday=13, tm_hour=19, tm_min=51, tm_sec=0, tm_wday=2, tm_yday=133, tm_isdst=0)"
The PE Paradox: Volatility Fuels New Deals as Old Assets Sit Frozen in Portfolios,"Glinting investment opportunities abound, private-equity firms say—but the industry also faces an exit bottleneck of over $3 trillion.","time.struct_time(tm_year=2026, tm_mon=5, tm_mday=13, tm_hour=19, tm_min=40, tm_sec=0, tm_wday=2, tm_yday=133, tm_isdst=0)"
Nvidia Rally Propels Stocks to New Records,The AI chip giant becomes the first company to reach a market value of $5.5 trillion.,"time.struct_time(tm_year=2026, tm_mon=5, tm_mday=13, tm_hour=21, tm_min=2, tm_sec=0, tm_wday=2, tm_yday=133, tm_isdst=0)"
Gold Edges Higher But Remains Pressured By Inflation Concerns,"Gold was holding above $4,700 a troy ounce, but remain pressured by expectations of higher-for-longer interest rates following the latest U.S. inflation data.","time.struct_time(tm_year=2026, tm_mon=5, tm_mday=14, tm_hour=7, tm_min=45, tm_sec=0, tm_wday=3, tm_yday=134, tm_isdst=0)"
