title,description,timestamp
SEC to Settle Lawsuit Against Elon Musk Over Twitter Share Purchases,The case had alleged that Musk failed to timely disclose his buildup of ownership in the social-media platform he later renamed X.,"time.struct_time(tm_year=2026, tm_mon=5, tm_mday=4, tm_hour=21, tm_min=42, tm_sec=0, tm_wday=0, tm_yday=124, tm_isdst=0)"
She Blew the Whistle on Deutsche Bank to the SEC. Her Award: $0.,"A former executive went public with claims that the bank wasn’t adhering to lofty goals on ESG, but missed out on a program that pays whistleblowers.","time.struct_time(tm_year=2026, tm_mon=5, tm_mday=4, tm_hour=12, tm_min=0, tm_sec=0, tm_wday=0, tm_yday=124, tm_isdst=0)"
The Fees That Fund Your Rewards Credit Card Are Facing a State Battle,"An Illinois law set to go into effect this summer would ban interchange fee on taxes and tips, and has banks up in arms.","time.struct_time(tm_year=2026, tm_mon=5, tm_mday=1, tm_hour=15, tm_min=50, tm_sec=0, tm_wday=4, tm_yday=121, tm_isdst=0)"
Private Credit’s Hot Streak Is Over,"The decline in returns is due to the Federal Reserve’s rate cuts and rising defaults on their loans, firms say.","time.struct_time(tm_year=2026, tm_mon=5, tm_mday=11, tm_hour=13, tm_min=39, tm_sec=0, tm_wday=0, tm_yday=131, tm_isdst=0)"
Leading Stocks Are Losing Their Low-Asset Edge,"Plus, all eyes on the Trump-Xi summit.","time.struct_time(tm_year=2026, tm_mon=5, tm_mday=11, tm_hour=10, tm_min=32, tm_sec=0, tm_wday=0, tm_yday=131, tm_isdst=0)"
KKR Private-Credit Fund Takes $560 Million Loss,The firm will invest $300 million in an effort to bolster the fund as loan defaults climb.,"time.struct_time(tm_year=2026, tm_mon=5, tm_mday=11, tm_hour=10, tm_min=30, tm_sec=0, tm_wday=0, tm_yday=131, tm_isdst=0)"
New Vanguard Hire Highlights Bond-Picking Push,The low-cost investment manager has nabbed a portfolio manager from Morgan Stanley while it builds out active funds to challenge incumbents like Pimco.,"time.struct_time(tm_year=2026, tm_mon=5, tm_mday=11, tm_hour=9, tm_min=30, tm_sec=0, tm_wday=0, tm_yday=131, tm_isdst=0)"
Iran War Puts the World’s Most Used Chemical in Short Supply,New Chinese export restrictions have further crimped sulfuric-acid markets.,"time.struct_time(tm_year=2026, tm_mon=5, tm_mday=9, tm_hour=16, tm_min=0, tm_sec=0, tm_wday=5, tm_yday=129, tm_isdst=0)"
JPMorgan Offered $1 Million Settlement Before Sexual Assault Claims Went Viral,Chirayu Rana’s lawsuit against JPMorgan followed failed settlement talks earlier in the year.,"time.struct_time(tm_year=2026, tm_mon=5, tm_mday=6, tm_hour=18, tm_min=47, tm_sec=0, tm_wday=2, tm_yday=126, tm_isdst=0)"
I Asked ChatGPT to Manage a Stock Portfolio. Here’s How It Did.,I planned to test it for a few weeks. What followed was a monthslong back-and-forth on everything from tariffs to leveraged funds.,"time.struct_time(tm_year=2026, tm_mon=5, tm_mday=5, tm_hour=9, tm_min=30, tm_sec=0, tm_wday=1, tm_yday=125, tm_isdst=0)"
Think $6 Gas Is Bad? It’s About to Get Even Worse in California,The Golden State depends more on crude-oil shipments from the Middle East than any other U.S. state.,"time.struct_time(tm_year=2026, tm_mon=5, tm_mday=11, tm_hour=9, tm_min=30, tm_sec=0, tm_wday=0, tm_yday=131, tm_isdst=0)"
Five Questions to Help You Make Better Financial Decisions,There is some simple math behind figuring out how to juggle multiple important goals.,"time.struct_time(tm_year=2026, tm_mon=5, tm_mday=9, tm_hour=23, tm_min=0, tm_sec=0, tm_wday=5, tm_yday=129, tm_isdst=0)"
6 of the Best Financial Advisor Companies: Well-Known Fiduciary Investment Firms to Consider,We analyzed everything from advisor credentials to fees to portfolio options at some of the larger and more well-known registered investment advisor firms to help you select a firm that could best connect you with a fiduciary financial advisor.,"time.struct_time(tm_year=2026, tm_mon=5, tm_mday=13, tm_hour=13, tm_min=9, tm_sec=0, tm_wday=2, tm_yday=133, tm_isdst=0)"
5 of the Top Financial Advisor Companies for Retirees: Well-Known Fiduciary Firms to Consider,We analyzed everything from estate planning to retirement income options at some of the larger registered investment advisor firms to help retirees select a firm that could best connect them with a fiduciary financial advisor.,"time.struct_time(tm_year=2026, tm_mon=4, tm_mday=15, tm_hour=19, tm_min=29, tm_sec=0, tm_wday=2, tm_yday=105, tm_isdst=0)"
6 of the Best Wealth Management Firms: Well-Known Fiduciary Investment Companies to Consider,We analyzed everything from advisor credentials to portfolio options to fees and customer support at some of the larger and more well-known registered investment advisor firms to help connect you with a fiduciary wealth manager.,"time.struct_time(tm_year=2026, tm_mon=4, tm_mday=15, tm_hour=19, tm_min=29, tm_sec=0, tm_wday=2, tm_yday=105, tm_isdst=0)"
The Tech Jobs That Are Safe From AI,Tech industry layoffs keep coming but there’s still a market for higher-grade talent to harness AI agents.,"time.struct_time(tm_year=2026, tm_mon=5, tm_mday=13, tm_hour=15, tm_min=45, tm_sec=0, tm_wday=2, tm_yday=133, tm_isdst=0)"
Anthropic Was Behind. Now It’s the AI Boom’s Front-Runner.,"After years as an also-ran, the startup has pulled ahead in the artificial-intelligence race after focusing on enterprise users and coding.","time.struct_time(tm_year=2026, tm_mon=5, tm_mday=13, tm_hour=14, tm_min=0, tm_sec=0, tm_wday=2, tm_yday=133, tm_isdst=0)"
"OpenAI CEO Sam Altman Defends His Leadership, Personal Investing at Trial",The blockbuster court battle centers around Musk’s donations to AI lab when it was a nonprofit and its conversion to a for-profit company.,"time.struct_time(tm_year=2026, tm_mon=5, tm_mday=12, tm_hour=23, tm_min=2, tm_sec=0, tm_wday=1, tm_yday=132, tm_isdst=0)"
SpaceX and Google Are in Talks to Launch Data Centers in Orbit,A deal between the two tech titans would give a boost to SpaceX’s business ahead of a historic public listing.,"time.struct_time(tm_year=2026, tm_mon=5, tm_mday=12, tm_hour=16, tm_min=7, tm_sec=0, tm_wday=1, tm_yday=132, tm_isdst=0)"
Nvidia Is Buying the Chip Supply Chain,"Plus, OpenAI’s employee payouts and tech’s growing unemployment.","time.struct_time(tm_year=2026, tm_mon=5, tm_mday=12, tm_hour=16, tm_min=0, tm_sec=0, tm_wday=1, tm_yday=132, tm_isdst=0)"
Intel’s Apple-Polished Comeback,"Plus, the hearing-walking correlation, Greg Brockman’s diary, Anthropic’s ‘Perfect Wingman’ and code-whispering.","time.struct_time(tm_year=2026, tm_mon=5, tm_mday=10, tm_hour=12, tm_min=3, tm_sec=0, tm_wday=6, tm_yday=130, tm_isdst=0)"
Typing Is Being Replaced by Whispering—and It’s Way More Annoying,"The latest productivity hack may be a little embarrassing, but enthusiasts believe it’s only a matter of time before every office sounds “more like a sales floor.”","time.struct_time(tm_year=2026, tm_mon=5, tm_mday=10, tm_hour=9, tm_min=30, tm_sec=0, tm_wday=6, tm_yday=130, tm_isdst=0)"
"Walking Slower? Why Your Ears, Not Your Knees, Might Be the Problem","Apple’s hearing study used real-world data from more than 57,000 iPhone users to make an important health connection.","time.struct_time(tm_year=2026, tm_mon=5, tm_mday=9, tm_hour=13, tm_min=0, tm_sec=0, tm_wday=5, tm_yday=129, tm_isdst=0)"
The End of Helicopter Parenting,"Plus, ChatGPT’s investing advice, health trackers without screens and why Gen Z is turning to the church","time.struct_time(tm_year=2026, tm_mon=5, tm_mday=9, tm_hour=11, tm_min=50, tm_sec=0, tm_wday=5, tm_yday=129, tm_isdst=0)"
"The New Rules of Sorority Rush, According to a Top Consultant","For around $5,000, Trisha Addicks coaches her clients on conversation skills and keeps them off #RushTok.","time.struct_time(tm_year=2026, tm_mon=5, tm_mday=8, tm_hour=15, tm_min=45, tm_sec=0, tm_wday=4, tm_yday=128, tm_isdst=0)"
Bayer to Buy Eye-Drug Developer Perfuse Therapeutics for Up to $2.45 Billion,The German pharmaceutical-and-agricultural group said the acquisition would complement its drug pipeline and leverage its ophthalmology footprint.,"time.struct_time(tm_year=2026, tm_mon=5, tm_mday=6, tm_hour=10, tm_min=44, tm_sec=0, tm_wday=2, tm_yday=126, tm_isdst=0)"
UCB to Buy Candid Therapeutics for Up to $2.2 Billion,The deal seeks to bolster the company’s pipeline of experimental treatments for autoimmune and inflammatory diseases.,"time.struct_time(tm_year=2026, tm_mon=5, tm_mday=4, tm_hour=7, tm_min=2, tm_sec=0, tm_wday=0, tm_yday=124, tm_isdst=0)"
The Quest to Use AI to Help Find New Drugs,Drug companies like Eli Lilly and Roche are racing to build supercomputers to help fix the 90% failure rate in drug development.,"time.struct_time(tm_year=2026, tm_mon=5, tm_mday=2, tm_hour=15, tm_min=45, tm_sec=0, tm_wday=5, tm_yday=122, tm_isdst=0)"
FDA Turns to AI to Speed Up Clinical Trials,The U.S. Food and Drug Administration seeks to accelerate clinical trials of new medicines by using artificial intelligence to streamline the laborious process of collecting and submitting study data.,"time.struct_time(tm_year=2026, tm_mon=4, tm_mday=28, tm_hour=17, tm_min=16, tm_sec=0, tm_wday=1, tm_yday=118, tm_isdst=0)"
FDA Approves First-Ever Gene Therapy to Restore Hearing,"Regeneron’s drug restored hearing in 11 of 12 children in a rare, inherited condition that causes deafness.","time.struct_time(tm_year=2026, tm_mon=4, tm_mday=23, tm_hour=20, tm_min=28, tm_sec=0, tm_wday=3, tm_yday=113, tm_isdst=0)"
Opinion | The Stakes of the Trump-Xi Summit,The U.S. wants ‘stability’ but China’s Communist leader has larger ambitions.,"time.struct_time(tm_year=2026, tm_mon=5, tm_mday=10, tm_hour=20, tm_min=2, tm_sec=0, tm_wday=6, tm_yday=130, tm_isdst=0)"
"Opinion | Tim Cook, Apple’s Gold Mine Manager",There may never be another iPhone. There may never be a substitute for the device either.,"time.struct_time(tm_year=2026, tm_mon=5, tm_mday=8, tm_hour=20, tm_min=32, tm_sec=0, tm_wday=4, tm_yday=128, tm_isdst=0)"
"Opinion | Trump-Vance Productivity Boom Threatened by Trump, Vance",A principal benefit of this administration has been its rejection of Biden A.I. policy.,"time.struct_time(tm_year=2026, tm_mon=5, tm_mday=8, tm_hour=20, tm_min=9, tm_sec=0, tm_wday=4, tm_yday=128, tm_isdst=0)"
Opinion | Habits for Humanity in the Age of AI,Help your kids build the character to make the most of technology rather than become a slave to it.,"time.struct_time(tm_year=2026, tm_mon=5, tm_mday=8, tm_hour=18, tm_min=15, tm_sec=0, tm_wday=4, tm_yday=128, tm_isdst=0)"
Elon Musk’s Grok Is Losing Ground in AI Race,Adoption by business and consumer users has slowed as parent SpaceX rents out spare computing capacity to rival Anthropic.,"time.struct_time(tm_year=2026, tm_mon=5, tm_mday=12, tm_hour=2, tm_min=0, tm_sec=0, tm_wday=1, tm_yday=132, tm_isdst=0)"
Microsoft CEO Testifies About Sam Altman’s Firing in Elon Musk Megatrial,Satya Nadella also testified about Microsoft’s partnership with OpenAI and the company’s support of Altman.,"time.struct_time(tm_year=2026, tm_mon=5, tm_mday=11, tm_hour=23, tm_min=24, tm_sec=0, tm_wday=0, tm_yday=131, tm_isdst=0)"
U.A.E.’s Secret Attacks on Iran,"Plus, the federal gas tax and beef prices might come down soon, and Michael Kors’ beach compound is for sale.","time.struct_time(tm_year=2026, tm_mon=5, tm_mday=11, tm_hour=21, tm_min=30, tm_sec=0, tm_wday=0, tm_yday=131, tm_isdst=0)"
"The Best AirPods, and How to Choose Which Pair Is Right for You",Breaking down Apple’s wireless headphone lineup.,"time.struct_time(tm_year=2026, tm_mon=3, tm_mday=4, tm_hour=19, tm_min=44, tm_sec=0, tm_wday=2, tm_yday=63, tm_isdst=0)"
The Best Mattress Toppers for Every Type of Sleeper,Does your mattress need an upgrade? We tested mattress toppers to find the best for all sleeping positions.,"time.struct_time(tm_year=2026, tm_mon=3, tm_mday=18, tm_hour=16, tm_min=50, tm_sec=0, tm_wday=2, tm_yday=77, tm_isdst=0)"
Best Robo Advisors of 2026,"Explore the leading robo advisors of 2026, comparing features, fees and services to find the right automated investment platform for your financial goals.","time.struct_time(tm_year=2026, tm_mon=3, tm_mday=2, tm_hour=18, tm_min=43, tm_sec=0, tm_wday=0, tm_yday=61, tm_isdst=0)"
Alex Murdaugh Granted New Trial for Murder of Wife and Son,The previous guilty verdict was thrown out after the South Carolina Supreme Court found fault with jury deliberations.,"time.struct_time(tm_year=2026, tm_mon=5, tm_mday=13, tm_hour=18, tm_min=34, tm_sec=0, tm_wday=2, tm_yday=133, tm_isdst=0)"
U.S. Drug Overdose Deaths Fall for Third Straight Year,"Fatalities declined nearly 14% in 2025 to prepandemic levels, driven by a drop in fentanyl and other opioid-related deaths.","time.struct_time(tm_year=2026, tm_mon=5, tm_mday=13, tm_hour=14, tm_min=0, tm_sec=0, tm_wday=2, tm_yday=133, tm_isdst=0)"
A Spending Splurge by Baltimore City Hall Is Stoking Taxpayer Outrage,"The mayor and city’s watchdog are locked in battle over access to City Hall internal records. A report cited baby showers, crab cakes and skyboxes.","time.struct_time(tm_year=2026, tm_mon=5, tm_mday=13, tm_hour=9, tm_min=30, tm_sec=0, tm_wday=2, tm_yday=133, tm_isdst=0)"
Princeton Changes Its 133-Year-Old Honor Code Over AI Cheating Fears,"Faculty voted to require proctoring in all in-person exams starting this summer, reversing a policy set in place in 1893.","time.struct_time(tm_year=2026, tm_mon=5, tm_mday=12, tm_hour=22, tm_min=51, tm_sec=0, tm_wday=1, tm_yday=132, tm_isdst=0)"
DOJ Charges Shipping Operator Involved in Deadly Baltimore Bridge Collapse,"Prosecutors have brought criminal charges against the operator of the containership that crashed into the Francis Scott Key Bridge in 2024, resulting in the death of six construction workers.","time.struct_time(tm_year=2026, tm_mon=5, tm_mday=12, tm_hour=18, tm_min=9, tm_sec=0, tm_wday=1, tm_yday=132, tm_isdst=0)"
Mamdani Abandons Plan for Raising New York City Property Taxes,"The mayor’s plan to raise the taxes by 9.5% drew backlash, but he still supports a tax on second homes worth $5 million or more.","time.struct_time(tm_year=2026, tm_mon=5, tm_mday=12, tm_hour=18, tm_min=1, tm_sec=0, tm_wday=1, tm_yday=132, tm_isdst=0)"
The Only Thing Harder Than Getting Into College Is Getting Off the Wait List,College wait lists have ballooned to give schools options; “Why continue stringing me on?”,"time.struct_time(tm_year=2026, tm_mon=5, tm_mday=11, tm_hour=0, tm_min=0, tm_sec=0, tm_wday=0, tm_yday=131, tm_isdst=0)"
The Simple Fix Small-Town Schools Are Using to Keep Teens Out of Dead-End Jobs,A model spearheaded by ex-Goldman Sachs banker Byron Trott fills the career-guidance void in many rural schools.,"time.struct_time(tm_year=2026, tm_mon=5, tm_mday=10, tm_hour=16, tm_min=0, tm_sec=0, tm_wday=6, tm_yday=130, tm_isdst=0)"
The Future of Elite Youth Sports Is Here—and It’s a Mess,High-school transfers have surged in Florida as players chase field time and winning teams in the age of big college paydays.,"time.struct_time(tm_year=2026, tm_mon=5, tm_mday=10, tm_hour=1, tm_min=0, tm_sec=0, tm_wday=6, tm_yday=130, tm_isdst=0)"
The Riskiest Gig in Public Speaking Is a College Graduation,Commencement speakers are getting death threats and disinvitations. One considered wearing a bulletproof vest.,"time.struct_time(tm_year=2026, tm_mon=5, tm_mday=9, tm_hour=9, tm_min=30, tm_sec=0, tm_wday=5, tm_yday=129, tm_isdst=0)"
Canvas Hack Temporarily Disrupts Thousands of Schools,"Canvas, one of the most widely used education apps, said it had restored services and notified the FBI of the intrusion.","time.struct_time(tm_year=2026, tm_mon=5, tm_mday=8, tm_hour=11, tm_min=57, tm_sec=0, tm_wday=4, tm_yday=128, tm_isdst=0)"
White House Explores 250 Pardons to Mark America’s 250th Birthday,"President Trump could make the announcements on June 14, which is both Flag Day and his birthday, or on the Fourth of July.","time.struct_time(tm_year=2026, tm_mon=5, tm_mday=13, tm_hour=16, tm_min=54, tm_sec=0, tm_wday=2, tm_yday=133, tm_isdst=0)"
New York Is Working on a Blueprint for Greener Buildings,"The city is investigating just how much carbon it takes to build its famous skyline, from the concrete foundations all the way up to the glass that frames skyscrapers.","time.struct_time(tm_year=2026, tm_mon=5, tm_mday=8, tm_hour=9, tm_min=30, tm_sec=0, tm_wday=4, tm_yday=128, tm_isdst=0)"
One of California’s Ritziest Beach Towns Has a Problem: A Tsunami of Raw Sewage,Coronado was “heaven on earth.” Then up to 30 million gallons a day of Tijuana waste turned its legendary beaches into a no-go zone.,"time.struct_time(tm_year=2026, tm_mon=5, tm_mday=4, tm_hour=15, tm_min=45, tm_sec=0, tm_wday=0, tm_yday=124, tm_isdst=0)"
Three American Farmers on How the Iran War Is Changing Their Plans,"To cut costs, farmers are slated to plant more soybeans and fewer corn acres this growing season.","time.struct_time(tm_year=2026, tm_mon=4, tm_mday=30, tm_hour=15, tm_min=45, tm_sec=0, tm_wday=3, tm_yday=120, tm_isdst=0)"
Natural Disasters Are Rewriting Home-Insurance Costs. See How It Impacts You.,"Hailstorms, wildfires and wind damage are hammering places once thought to be shielded from the worst rate hikes, a Wall Street Journal analysis of premiums found.","time.struct_time(tm_year=2026, tm_mon=4, tm_mday=29, tm_hour=9, tm_min=30, tm_sec=0, tm_wday=2, tm_yday=119, tm_isdst=0)"
Camp Mystic Told It Might Not Get State License to Reopen,"Texas officials said emergency plans at the summer camp, hit by deadly flooding last year, fell short in more than 20 categories.","time.struct_time(tm_year=2026, tm_mon=4, tm_mday=24, tm_hour=21, tm_min=9, tm_sec=0, tm_wday=4, tm_yday=114, tm_isdst=0)"
Opinion | Democrats’ Redistricting Outburst,The left receives two unfavorable court rulings—and loses it.,"time.struct_time(tm_year=2026, tm_mon=5, tm_mday=13, tm_hour=15, tm_min=52, tm_sec=0, tm_wday=2, tm_yday=133, tm_isdst=0)"
Opinion | Two Sides of the Medication Abortion Debate,Readers weigh in on the debate over mifepristone.,"time.struct_time(tm_year=2026, tm_mon=5, tm_mday=13, tm_hour=13, tm_min=32, tm_sec=0, tm_wday=2, tm_yday=133, tm_isdst=0)"
Opinion | The Sunshine State Leads on School Choice,Everything is bigger in Texas? Not so fast. Florida is ahead on scholarships.,"time.struct_time(tm_year=2026, tm_mon=5, tm_mday=13, tm_hour=13, tm_min=31, tm_sec=0, tm_wday=2, tm_yday=133, tm_isdst=0)"
Ann Arbor Would Like to Report a ‘Massacre’ of Its Trees,Utility company DTE Energy says its trimmers are keeping the power on. That’s not good enough for the canopy-loving residents of Tree Town.,"time.struct_time(tm_year=2026, tm_mon=5, tm_mday=12, tm_hour=9, tm_min=30, tm_sec=0, tm_wday=1, tm_yday=132, tm_isdst=0)"
"Trump’s Battleship Will Be Nuclear Powered, Navy Says",The move is expected to increase the cost and complexity of a multibillion-dollar project that was the subject of some lawmaker skepticism.,"time.struct_time(tm_year=2026, tm_mon=5, tm_mday=12, tm_hour=0, tm_min=43, tm_sec=0, tm_wday=1, tm_yday=132, tm_isdst=0)"
Wichita Is a Rare Mecca of Affordability for America’s New Middle Class,"Rent, food and other costs are cheaper than the national average. A duplex boom is attracting middle-income earners to the Midwestern city.","time.struct_time(tm_year=2026, tm_mon=5, tm_mday=11, tm_hour=1, tm_min=0, tm_sec=0, tm_wday=0, tm_yday=131, tm_isdst=0)"
A Blunt Judge and Two Star Litigators: The Legal Players in Musk’s OpenAI Suit,The trial features a jurist known for straight talk and lawyers who have worked on milestone cases.,"time.struct_time(tm_year=2026, tm_mon=5, tm_mday=10, tm_hour=15, tm_min=0, tm_sec=0, tm_wday=6, tm_yday=130, tm_isdst=0)"
We Asked a Church Group to Weigh In on Trump. Here’s What They Said.,"Politically diverse members discuss their relationship with politics, war and faith under the Trump administration.","time.struct_time(tm_year=2026, tm_mon=5, tm_mday=10, tm_hour=11, tm_min=0, tm_sec=0, tm_wday=6, tm_yday=130, tm_isdst=0)"
Fortress Co-Founder Allegedly Extorted by Sexual Partner,"A woman was charged for allegedly threatening to share sex videos and photos of billionaire Wesley Edens, who also co-owns the Milwaukee Bucks.","time.struct_time(tm_year=2026, tm_mon=5, tm_mday=10, tm_hour=9, tm_min=30, tm_sec=0, tm_wday=6, tm_yday=130, tm_isdst=0)"
The Latest Hero of the ‘Yimby’ Movement Is a Massachusetts Man in a Hoodie,"One wealthy Massachusetts town’s housing plan won’t add much housing, and a local called them out.","time.struct_time(tm_year=2026, tm_mon=5, tm_mday=8, tm_hour=0, tm_min=23, tm_sec=0, tm_wday=4, tm_yday=128, tm_isdst=0)"
The Fight to Free Hundreds of Beagles From a Rural Wisconsin Research Lab,"In an “open rescue,” activists struck breeder Ridglan Farms in daylight, courting arrest and setting up a tear-gas-fueled clash before a deal was reached to rehome 1,500 dogs.","time.struct_time(tm_year=2026, tm_mon=5, tm_mday=7, tm_hour=9, tm_min=30, tm_sec=0, tm_wday=3, tm_yday=127, tm_isdst=0)"
Cheapest Car Insurance Companies 2026,The best cheap car insurance companies offer low rates but don’t skimp on coverage options.,"time.struct_time(tm_year=2026, tm_mon=4, tm_mday=15, tm_hour=19, tm_min=29, tm_sec=0, tm_wday=2, tm_yday=105, tm_isdst=0)"
Best Pet Insurance Companies of 2026,Top pet insurance companies to safeguard your wallet from pet medical bills.,"time.struct_time(tm_year=2026, tm_mon=4, tm_mday=15, tm_hour=19, tm_min=29, tm_sec=0, tm_wday=2, tm_yday=105, tm_isdst=0)"
Best Term Life Insurance Companies of 2026,"We analyzed 19 term life insurance companies to find the best options based on cost, coverage and complaints.","time.struct_time(tm_year=2026, tm_mon=4, tm_mday=15, tm_hour=19, tm_min=29, tm_sec=0, tm_wday=2, tm_yday=105, tm_isdst=0)"
"White House officials are weighing a plan for President Trump to issue 250 pardons as a way to mark the celebration of the nation’s 250th birthday, according to people familiar with the matter.","President Trump could make the announcements on June 14, which is both Flag Day and his birthday, or on the Fourth of July.","time.struct_time(tm_year=2026, tm_mon=5, tm_mday=13, tm_hour=16, tm_min=54, tm_sec=0, tm_wday=2, tm_yday=133, tm_isdst=0)"
Vice President JD Vance is planning to deliver an ultimatum to all 50 states: Fully comply with antifraud statutes or run the risk of losing federal Medicaid funding,The Trump administration is set to launch audits of state watchdogs responsible for ferreting out wrongdoing.,"time.struct_time(tm_year=2026, tm_mon=5, tm_mday=13, tm_hour=14, tm_min=0, tm_sec=0, tm_wday=2, tm_yday=133, tm_isdst=0)"
The Department of Homeland Security’s inspector general has launched a probe into the $38 billion warehouse-to-detention program championed by former Secretary Kristi Noem,The Department of Homeland Security’s inspector general is investigating a $38 billion program championed by the former DHS secretary.,"time.struct_time(tm_year=2026, tm_mon=5, tm_mday=13, tm_hour=11, tm_min=57, tm_sec=0, tm_wday=2, tm_yday=133, tm_isdst=0)"
RFK Jr. keeps losing top officials as the FDA head resigns. Read more in today’s WSJ Politics newsletter:,"Plus, Trump’s late-night posts on Truth Social, and what he and China’s Xi Jinping want from their high-stakes Beijing summit.","time.struct_time(tm_year=2026, tm_mon=5, tm_mday=13, tm_hour=11, tm_min=8, tm_sec=0, tm_wday=2, tm_yday=133, tm_isdst=0)"
A Nebraska state senator and a former communications executive were in a tight Democratic congressional primary early Wednesday for a House seat left open by retiring GOP Rep. Don Bacon,Former communications executive Denise Powell leads the race to fill a seat that has become a factor in presidential politics.,"time.struct_time(tm_year=2026, tm_mon=5, tm_mday=13, tm_hour=6, tm_min=40, tm_sec=0, tm_wday=2, tm_yday=133, tm_isdst=0)"
Senior leaders in the White House concluded that FDA Commissioner Marty Makary was out of step with President Trump’s priorities,Senior administration officials concluded the Food and Drug Administration commissioner was out of step with President Trump’s priorities.,"time.struct_time(tm_year=2026, tm_mon=5, tm_mday=13, tm_hour=1, tm_min=50, tm_sec=0, tm_wday=2, tm_yday=133, tm_isdst=0)"
"The Trump administration will designate David Venturella, a former private prison company executive and former career employee of ICE, as its next acting director",David Venturella has advocated for the use of warehouses for immigration detention.,"time.struct_time(tm_year=2026, tm_mon=5, tm_mday=13, tm_hour=1, tm_min=46, tm_sec=0, tm_wday=2, tm_yday=133, tm_isdst=0)"
"FDA Commissioner Marty Makary is leaving his role, President Trump told reporters Tuesday, after Makary had battled officials in the health department and the White House on a range of policy issues",Marty Makary had battled officials in the health department and the White House on a range of policy issues.,"time.struct_time(tm_year=2026, tm_mon=5, tm_mday=12, tm_hour=23, tm_min=20, tm_sec=0, tm_wday=1, tm_yday=132, tm_isdst=0)"
PayPal agrees to waive $30 million in fees to settle Justice Department probe into minority-business funding program,The case is part of the Trump administration’s campaign against corporate DEI initiatives.,"time.struct_time(tm_year=2026, tm_mon=5, tm_mday=12, tm_hour=13, tm_min=45, tm_sec=0, tm_wday=1, tm_yday=132, tm_isdst=0)"
"The Trump administration said it would delay a plan to address high beef prices, which would have suspended tariffs on imported beef",The administration was set to suspend tariff-rate quotas on all beef-exporting nations. Beef prices have climbed steadily since Trump took office.,"time.struct_time(tm_year=2026, tm_mon=5, tm_mday=12, tm_hour=0, tm_min=34, tm_sec=0, tm_wday=1, tm_yday=132, tm_isdst=0)"
